{
  "schema_version": "2026-05-29",
  "dataset_name": "rag-chat-research-benchmark-draft",
  "extends": "rag-benchmark.interim-draft.json",
  "questions": [
    {
      "question_id": "wildcat-location-units",
      "question": "Where is The Residences at Wildcat Creek located and how many units does it contain?",
      "evaluation_slice": "narrative",
      "scope_type": "entity_scoped",
      "table_heavy": false,
      "target_entities": ["The Residences at Wildcat Creek"],
      "target_document_ids": ["a721bf4b-5cde-422a-9bb5-92d8f6f894dc"],
      "expected_answer_substrings": ["Kokomo, Indiana", "70-unit", "70 units"],
      "gold_evidence": [
        {
          "document_id": "a721bf4b-5cde-422a-9bb5-92d8f6f894dc",
          "page": 8,
          "evidence_type": "narrative",
          "field_label": "location_and_unit_count",
          "relevance": 3,
          "supports": ["retrieval", "generation", "citation"]
        }
      ],
      "notes": "Research expansion question from OM-DUPLEX-COMMUNITY.pdf."
    },
    {
      "question_id": "wildcat-buildings-expansion",
      "question": "How many buildings currently make up The Residences at Wildcat Creek, and how many additional buildings could vacant ground support?",
      "evaluation_slice": "entity_scoped",
      "scope_type": "entity_scoped",
      "table_heavy": false,
      "target_entities": ["The Residences at Wildcat Creek"],
      "target_document_ids": ["a721bf4b-5cde-422a-9bb5-92d8f6f894dc"],
      "expected_answer_substrings": ["35 buildings", "4-5 additional buildings"],
      "gold_evidence": [
        {
          "document_id": "a721bf4b-5cde-422a-9bb5-92d8f6f894dc",
          "page": 8,
          "evidence_type": "narrative",
          "field_label": "building_count_and_expansion_capacity",
          "relevance": 3,
          "supports": ["retrieval", "generation", "citation"]
        }
      ],
      "notes": "Research expansion question from OM-DUPLEX-COMMUNITY.pdf."
    },
    {
      "question_id": "wildcat-unit-mix",
      "question": "What is the unit mix at The Residences at Wildcat Creek?",
      "evaluation_slice": "table_factual",
      "scope_type": "entity_scoped",
      "table_heavy": false,
      "target_entities": ["The Residences at Wildcat Creek"],
      "target_document_ids": ["a721bf4b-5cde-422a-9bb5-92d8f6f894dc"],
      "expected_answer_substrings": ["38 one-bedroom units", "32 two-bedroom units"],
      "gold_evidence": [
        {
          "document_id": "a721bf4b-5cde-422a-9bb5-92d8f6f894dc",
          "page": 8,
          "evidence_type": "narrative",
          "field_label": "unit_mix",
          "relevance": 3,
          "supports": ["retrieval", "generation", "citation"]
        }
      ],
      "notes": "Research expansion question from OM-DUPLEX-COMMUNITY.pdf."
    },
    {
      "question_id": "wildcat-noi-bid-basis",
      "question": "On what 2019 NOI are investors requested to bid for The Residences at Wildcat Creek?",
      "evaluation_slice": "narrative",
      "scope_type": "entity_scoped",
      "table_heavy": false,
      "target_entities": ["The Residences at Wildcat Creek"],
      "target_document_ids": ["a721bf4b-5cde-422a-9bb5-92d8f6f894dc"],
      "expected_answer_substrings": ["$406,891", "406,891"],
      "gold_evidence": [
        {
          "document_id": "a721bf4b-5cde-422a-9bb5-92d8f6f894dc",
          "page": 14,
          "evidence_type": "narrative",
          "field_label": "bid_basis_noi_2019",
          "relevance": 3,
          "supports": ["retrieval", "generation", "citation"]
        }
      ],
      "notes": "Research expansion question from OM-DUPLEX-COMMUNITY.pdf."
    },
    {
      "question_id": "wildcat-location-amenities",
      "question": "What nearby trails, parks, and downtown access features are highlighted for The Residences at Wildcat Creek?",
      "evaluation_slice": "narrative",
      "scope_type": "entity_scoped",
      "table_heavy": false,
      "target_entities": ["The Residences at Wildcat Creek"],
      "target_document_ids": ["a721bf4b-5cde-422a-9bb5-92d8f6f894dc"],
      "expected_answer_substrings": ["UCT Park", "Walk of Excellence Trail", "downtown Kokomo", "Mehlig Dog Park"],
      "gold_evidence": [
        {
          "document_id": "a721bf4b-5cde-422a-9bb5-92d8f6f894dc",
          "page": 8,
          "evidence_type": "narrative",
          "field_label": "nearby_amenities",
          "relevance": 3,
          "supports": ["retrieval", "generation", "citation"]
        }
      ],
      "notes": "Research expansion question from OM-DUPLEX-COMMUNITY.pdf."
    },
    {
      "question_id": "wildcat-private-space-design",
      "question": "What private-space design features are highlighted for each unit at The Residences at Wildcat Creek?",
      "evaluation_slice": "narrative",
      "scope_type": "entity_scoped",
      "table_heavy": false,
      "target_entities": ["The Residences at Wildcat Creek"],
      "target_document_ids": ["a721bf4b-5cde-422a-9bb5-92d8f6f894dc"],
      "expected_answer_substrings": ["private entry", "private driveway", "private patio", "private outdoor space"],
      "gold_evidence": [
        {
          "document_id": "a721bf4b-5cde-422a-9bb5-92d8f6f894dc",
          "page": 8,
          "evidence_type": "narrative",
          "field_label": "private_space_features",
          "relevance": 3,
          "supports": ["retrieval", "generation", "citation"]
        }
      ],
      "notes": "Research expansion question from OM-DUPLEX-COMMUNITY.pdf."
    },

    {
      "question_id": "la905-asset-profile",
      "question": "What is the property type, unit count, and building square footage for 905 2nd St in Santa Monica?",
      "evaluation_slice": "entity_scoped",
      "scope_type": "entity_scoped",
      "table_heavy": false,
      "target_entities": ["905 2nd St"],
      "target_document_ids": ["9decb0a0-cda1-4537-9094-7e0b8eaf5cc8"],
      "expected_answer_substrings": ["Multi-Family Residence", "20", "12,571"],
      "gold_evidence": [
        {
          "document_id": "9decb0a0-cda1-4537-9094-7e0b8eaf5cc8",
          "page": 1,
          "evidence_type": "key_value",
          "field_label": "asset_profile",
          "relevance": 3,
          "supports": ["retrieval", "generation", "citation"]
        }
      ],
      "notes": "Research tax-assessment question from LA_Assessment_prop-3.pdf."
    },
    {
      "question_id": "la905-land-usable-sqft",
      "question": "What is the usable square footage for 905 2nd St, Santa Monica?",
      "evaluation_slice": "table_factual",
      "scope_type": "entity_scoped",
      "table_heavy": false,
      "target_entities": ["905 2nd St"],
      "target_document_ids": ["9decb0a0-cda1-4537-9094-7e0b8eaf5cc8"],
      "expected_answer_substrings": ["9,997", "9997"],
      "gold_evidence": [
        {
          "document_id": "9decb0a0-cda1-4537-9094-7e0b8eaf5cc8",
          "page": 3,
          "evidence_type": "key_value",
          "field_label": "usable_square_feet",
          "relevance": 3,
          "supports": ["retrieval", "generation", "citation"]
        }
      ],
      "notes": "Research tax-assessment question from LA_Assessment_prop-3.pdf."
    },
    {
      "question_id": "la905-year-built-quality",
      "question": "What year was the building built, and what quality class is listed for 905 2nd St?",
      "evaluation_slice": "entity_scoped",
      "scope_type": "entity_scoped",
      "table_heavy": false,
      "target_entities": ["905 2nd St"],
      "target_document_ids": ["9decb0a0-cda1-4537-9094-7e0b8eaf5cc8"],
      "expected_answer_substrings": ["1923", "D55"],
      "gold_evidence": [
        {
          "document_id": "9decb0a0-cda1-4537-9094-7e0b8eaf5cc8",
          "page": 1,
          "evidence_type": "key_value",
          "field_label": "year_built_and_quality_class",
          "relevance": 3,
          "supports": ["retrieval", "generation", "citation"]
        }
      ],
      "notes": "Research tax-assessment question from LA_Assessment_prop-3.pdf."
    },
    {
      "question_id": "la905-sale-2023-record",
      "question": "What recorded amount appears in the 08/02/2023 transfer row for 905 2nd St?",
      "evaluation_slice": "table_factual",
      "scope_type": "entity_scoped",
      "table_heavy": true,
      "target_entities": ["905 2nd St"],
      "target_document_ids": ["9decb0a0-cda1-4537-9094-7e0b8eaf5cc8"],
      "expected_answer_substrings": ["$6,191,400", "6,191,400"],
      "gold_evidence": [
        {
          "document_id": "9decb0a0-cda1-4537-9094-7e0b8eaf5cc8",
          "page": 4,
          "evidence_type": "table",
          "field_label": "recorded_amount_2023_08_02",
          "relevance": 3,
          "supports": ["retrieval", "generation", "citation"]
        }
      ],
      "notes": "Research tax-assessment question from LA_Assessment_prop-3.pdf."
    },

    {
      "question_id": "la200vermont-roll-total",
      "question": "What is the 2025 current roll total value for 200 N Vermont Ave in Los Angeles?",
      "evaluation_slice": "table_factual",
      "scope_type": "entity_scoped",
      "table_heavy": true,
      "target_entities": ["200 N Vermont Ave"],
      "target_document_ids": ["e6fa605c-4471-4a1d-8a72-29ca6da4ac61"],
      "expected_answer_substrings": ["$107,848,222", "107,848,222"],
      "gold_evidence": [
        {
          "document_id": "e6fa605c-4471-4a1d-8a72-29ca6da4ac61",
          "page": 1,
          "evidence_type": "table",
          "field_label": "current_roll_total_2025",
          "relevance": 3,
          "supports": ["retrieval", "generation", "citation"]
        }
      ],
      "notes": "Research tax-assessment question from LA_Assessment_prop-2.pdf."
    },
    {
      "question_id": "la200vermont-land-improvements",
      "question": "What are the 2025 current roll land and improvement values for 200 N Vermont Ave?",
      "evaluation_slice": "table_factual",